{
  "schema_version": 1,
  "scope": "P13_00_AND_A_THROUGH_F",
  "baseline": {
    "checked_at_utc": "2026-10-22T04:15:31.131209+00:00",
    "main_sha": "eb5143500bed5395bb45f2a2cc20335da9988491",
    "tree_sha": "d717c16a9ff54de1136c9b1b719fd9c597cf4e40",
    "main_ci_run": 39719175508,
    "main_ci_conclusion": "SUCCESS",
    "main_ci_profile": "full",
    "main_ci_jobs_passed": 10,
    "open_prs_at_start": 0,
    "remote_branches_at_start": [
      "main"
    ],
    "taskbook_sha256": "03c1e49e781722b8a28913b18937426e6a4cfda84e6237c8dde7dd69a4e3feba",
    "migration_head": "0017_paid_model_gate",
    "p13_wheel_sha256": null,
    "p13_container_image_ids": null,
    "p13_registry_image_digests": null,
    "historical_evidence": "p12-gates.json",
    "historical_p11": {
      "inputs": 6,
      "model_calls": 8,
      "phone_confirmations": 6,
      "configured_micro_usd": 1020,
      "supplier_invoice_micro_usd": null
    },
    "scope_excludes": [
      "P13-L_LICENSE_DECISION"
    ]
  },
  "runtime": {
    "current_host_state": "NOT_RECHECKED",
    "server_connection_this_batch": false,
    "new_authority": {
      "host_read": null,
      "R1_restore": null,
      "R2_deployment": null,
      "R3_qq": null,
      "R4_paid_model": null,
      "R5_read": null,
      "R5_write": null,
      "R5_correct": null,
      "R5_forget": null,
      "R6_reader": null,
      "media_fetch": null,
      "paid_vision": null,
      "private_diary": null,
      "affect_expression": null,
      "autonomous_send": null
    },
    "actual_candidate_sha": null,
    "actual_config_sha256": null,
    "actual_images": null,
    "new_real_qq_inputs": 0,
    "new_real_paid_calls": 0,
    "new_phone_confirmations": null,
    "natural_days": null
  },
  "packages": {
    "A0": {
      "status": "NOT_RUN",
      "evidence": {
        "implementation": "NOT_RUN",
        "offline": "NOT_RUN",
        "protocol": {
          "local": "NOT_RUN",
          "platform": "NOT_RUN"
        },
        "provider": "NOT_RUN",
        "phone": "NOT_RUN",
        "cross_natural_days": "NOT_RUN",
        "recovery": {
          "local": "NOT_RUN",
          "business": "NOT_RUN"
        },
        "release": "DISABLED"
      },
      "runtime_samples": 0,
      "runtime_approval_sha256": null,
      "runtime_evidence_sha256": null,
      "natural_days": null,
      "pr": null,
      "blockers": [
        "NEW_EXACT_RUNTIME_SCOPE_REQUIRED"
      ]
    },
    "A1": {
      "status": "NOT_RUN",
      "evidence": {
        "implementation": "NOT_RUN",
        "offline": "NOT_RUN",
        "protocol": {
          "local": "NOT_RUN",
          "platform": "NOT_RUN"
        },
        "provider": "NOT_RUN",
        "phone": "NOT_RUN",
        "cross_natural_days": "NOT_RUN",
        "recovery": {
          "local": "NOT_RUN",
          "business": "NOT_RUN"
        },
        "release": "DISABLED"
      },
      "runtime_samples": 0,
      "runtime_approval_sha256": null,
      "runtime_evidence_sha256": null,
      "natural_days": null,
      "pr": null,
      "blockers": [
        "NEW_EXACT_RUNTIME_SCOPE_REQUIRED"
      ]
    },
    "B0": {
      "status": "NOT_RUN",
      "evidence": {
        "implementation": "NOT_RUN",
        "offline": "NOT_RUN",
        "protocol": {
          "local": "NOT_RUN",
          "platform": "NOT_RUN"
        },
        "provider": "NOT_RUN",
        "phone": "NOT_RUN",
        "cross_natural_days": "NOT_RUN",
        "recovery": {
          "local": "NOT_RUN",
          "business": "NOT_RUN"
        },
        "release": "DISABLED"
      },
      "runtime_samples": 0,
      "runtime_approval_sha256": null,
      "runtime_evidence_sha256": null,
      "natural_days": null,
      "pr": null,
      "blockers": [
        "NEW_EXACT_RUNTIME_SCOPE_REQUIRED"
      ]
    },
    "B1": {
      "status": "NOT_RUN",
      "evidence": {
        "implementation": "NOT_RUN",
        "offline": "NOT_RUN",
        "protocol": {
          "local": "NOT_RUN",
          "platform": "NOT_RUN"
        },
        "provider": "NOT_RUN",
        "phone": "NOT_RUN",
        "cross_natural_days": "NOT_RUN",
        "recovery": {
          "local": "NOT_RUN",
          "business": "NOT_RUN"
        },
        "release": "DISABLED"
      },
      "runtime_samples": 0,
      "runtime_approval_sha256": null,
      "runtime_evidence_sha256": null,
      "natural_days": null,
      "pr": null,
      "blockers": [
        "NEW_EXACT_RUNTIME_SCOPE_REQUIRED"
      ]
    },
    "B2": {
      "status": "NOT_RUN",
      "evidence": {
        "implementation": "NOT_RUN",
        "offline": "NOT_RUN",
        "protocol": {
          "local": "NOT_RUN",
          "platform": "NOT_RUN"
        },
        "provider": "NOT_RUN",
        "phone": "NOT_RUN",
        "cross_natural_days": "NOT_RUN",
        "recovery": {
          "local": "NOT_RUN",
          "business": "NOT_RUN"
        },
        "release": "DISABLED"
      },
      "runtime_samples": 0,
      "runtime_approval_sha256": null,
      "runtime_evidence_sha256": null,
      "natural_days": null,
      "pr": null,
      "blockers": [
        "NEW_EXACT_RUNTIME_SCOPE_REQUIRED"
      ]
    },
    "B3": {
      "status": "NOT_RUN",
      "evidence": {
        "implementation": "NOT_RUN",
        "offline": "NOT_RUN",
        "protocol": {
          "local": "NOT_RUN",
          "platform": "NOT_RUN"
        },
        "provider": "NOT_RUN",
        "phone": "NOT_RUN",
        "cross_natural_days": "NOT_RUN",
        "recovery": {
          "local": "NOT_RUN",
          "business": "NOT_RUN"
        },
        "release": "DISABLED"
      },
      "runtime_samples": 0,
      "runtime_approval_sha256": null,
      "runtime_evidence_sha256": null,
      "natural_days": null,
      "pr": null,
      "blockers": [
        "NEW_EXACT_RUNTIME_SCOPE_REQUIRED"
      ]
    },
    "C1": {
      "status": "NOT_RUN",
      "evidence": {
        "implementation": "NOT_RUN",
        "offline": "NOT_RUN",
        "protocol": {
          "local": "NOT_RUN",
          "platform": "NOT_RUN"
        },
        "provider": "NOT_RUN",
        "phone": "NOT_RUN",
        "cross_natural_days": "NOT_RUN",
        "recovery": {
          "local": "NOT_RUN",
          "business": "NOT_RUN"
        },
        "release": "DISABLED"
      },
      "runtime_samples": 0,
      "runtime_approval_sha256": null,
      "runtime_evidence_sha256": null,
      "natural_days": null,
      "pr": null,
      "blockers": [
        "NEW_EXACT_RUNTIME_SCOPE_REQUIRED"
      ]
    },
    "C2": {
      "status": "NOT_RUN",
      "evidence": {
        "implementation": "NOT_RUN",
        "offline": "NOT_RUN",
        "protocol": {
          "local": "NOT_RUN",
          "platform": "NOT_RUN"
        },
        "provider": "NOT_RUN",
        "phone": "NOT_RUN",
        "cross_natural_days": "NOT_RUN",
        "recovery": {
          "local": "NOT_RUN",
          "business": "NOT_RUN"
        },
        "release": "DISABLED"
      },
      "runtime_samples": 0,
      "runtime_approval_sha256": null,
      "runtime_evidence_sha256": null,
      "natural_days": null,
      "pr": null,
      "blockers": [
        "NEW_EXACT_RUNTIME_SCOPE_REQUIRED"
      ]
    },
    "C3": {
      "status": "NOT_RUN",
      "evidence": {
        "implementation": "NOT_RUN",
        "offline": "NOT_RUN",
        "protocol": {
          "local": "NOT_RUN",
          "platform": "NOT_RUN"
        },
        "provider": "NOT_RUN",
        "phone": "NOT_RUN",
        "cross_natural_days": "NOT_RUN",
        "recovery": {
          "local": "NOT_RUN",
          "business": "NOT_RUN"
        },
        "release": "DISABLED"
      },
      "runtime_samples": 0,
      "runtime_approval_sha256": null,
      "runtime_evidence_sha256": null,
      "natural_days": null,
      "pr": null,
      "blockers": [
        "NEW_EXACT_RUNTIME_SCOPE_REQUIRED"
      ]
    },
    "C4": {
      "status": "NOT_RUN",
      "evidence": {
        "implementation": "NOT_RUN",
        "offline": "NOT_RUN",
        "protocol": {
          "local": "NOT_RUN",
          "platform": "NOT_RUN"
        },
        "provider": "NOT_RUN",
        "phone": "NOT_RUN",
        "cross_natural_days": "NOT_RUN",
        "recovery": {
          "local": "NOT_RUN",
          "business": "NOT_RUN"
        },
        "release": "DISABLED"
      },
      "runtime_samples": 0,
      "runtime_approval_sha256": null,
      "runtime_evidence_sha256": null,
      "natural_days": null,
      "pr": null,
      "blockers": [
        "NEW_EXACT_RUNTIME_SCOPE_REQUIRED"
      ]
    },
    "D1": {
      "status": "NOT_RUN",
      "evidence": {
        "implementation": "NOT_RUN",
        "offline": "NOT_RUN",
        "protocol": {
          "local": "NOT_RUN",
          "platform": "NOT_RUN"
        },
        "provider": "NOT_RUN",
        "phone": "NOT_RUN",
        "cross_natural_days": "NOT_RUN",
        "recovery": {
          "local": "NOT_RUN",
          "business": "NOT_RUN"
        },
        "release": "DISABLED"
      },
      "runtime_samples": 0,
      "runtime_approval_sha256": null,
      "runtime_evidence_sha256": null,
      "natural_days": null,
      "pr": null,
      "blockers": [
        "NEW_EXACT_RUNTIME_SCOPE_REQUIRED"
      ]
    },
    "D2": {
      "status": "NOT_RUN",
      "evidence": {
        "implementation": "NOT_RUN",
        "offline": "NOT_RUN",
        "protocol": {
          "local": "NOT_RUN",
          "platform": "NOT_RUN"
        },
        "provider": "NOT_RUN",
        "phone": "NOT_RUN",
        "cross_natural_days": "NOT_RUN",
        "recovery": {
          "local": "NOT_RUN",
          "business": "NOT_RUN"
        },
        "release": "DISABLED"
      },
      "runtime_samples": 0,
      "runtime_approval_sha256": null,
      "runtime_evidence_sha256": null,
      "natural_days": null,
      "pr": null,
      "blockers": [
        "NEW_EXACT_RUNTIME_SCOPE_REQUIRED"
      ]
    },